{
  "schemaVersion": 1,
  "id": "av-cadrage-plateforme",
  "name": "Note de cadrage technique de la plateforme",
  "publisher": "SkillzForest",
  "version": "0.1.0",
  "category": "pre-sales",
  "description": "Produit la note de cadrage technique de la plateforme (architecture, composants, budget) d'un projet.",
  "compatibility": {
    "claude-code": "native",
    "claude-ai": "native",
    "codex": "supported",
    "gemini": "supported",
    "mistral": "supported",
    "perplexity": "supported",
    "chatgpt": "unknown",
    "cursor": "unknown",
    "opencode": "unknown"
  }
}
