{
  "schemaVersion": 1,
  "id": "av-schema-physique",
  "name": "Schéma d'infrastructure physique (.excalidraw)",
  "publisher": "SkillzForest",
  "version": "0.1.0",
  "category": "pre-sales",
  "description": "Génère le schéma d'infrastructure physique d'un projet (.excalidraw) : serveurs, sous-réseaux, flux.",
  "compatibility": {
    "claude-code": "native",
    "claude-ai": "native",
    "codex": "supported",
    "gemini": "supported",
    "mistral": "supported",
    "perplexity": "supported",
    "chatgpt": "unknown",
    "cursor": "unknown",
    "opencode": "unknown"
  }
}
