{
  "schemaVersion": 1,
  "id": "presales-init-project",
  "name": "Initialisation Drive d'un projet avant-vente",
  "publisher": "SkillzForest",
  "version": "0.1.0",
  "category": "pre-sales",
  "description": "Initialise l'arborescence Drive standard d'un nouveau projet avant-vente et y copie les documents modèles.",
  "compatibility": {
    "claude-code": "native",
    "claude-ai": "native",
    "codex": "supported",
    "gemini": "supported",
    "mistral": "supported",
    "perplexity": "supported",
    "chatgpt": "unknown",
    "cursor": "unknown",
    "opencode": "unknown"
  }
}
