{
  "schemaVersion": 1,
  "id": "av-presentation-client",
  "name": "Présentation client (Google Slides)",
  "publisher": "SkillzForest",
  "version": "0.1.0",
  "category": "pre-sales",
  "description": "Assemble la présentation client (deck) à partir des livrables avant-vente déjà produits.",
  "compatibility": {
    "claude-code": "native",
    "claude-ai": "native",
    "codex": "supported",
    "gemini": "supported",
    "mistral": "supported",
    "perplexity": "supported",
    "chatgpt": "unknown",
    "cursor": "unknown",
    "opencode": "unknown"
  }
}
