{
  "schemaVersion": 1,
  "id": "skf-github-issue-brief",
  "name": "GitHub Issue Brief",
  "publisher": "SkillzForest",
  "version": "1.3.1",
  "category": "development",
  "subcategory": "code",
  "description": "Collects a GitHub Issue — text, comments, screenshots, attachments — into a stable .agent/issues/NUMBER/context.json + context.md bundle, for one issue or a whole GitHub Project board at once. Installs the GitHub CLI when it is missing and guides sign-in.",
  "compatibility": {
    "claude-code": "native",
    "claude-ai": "unsupported",
    "codex": "unknown",
    "gemini": "unknown",
    "mistral": "unsupported",
    "perplexity": "unsupported",
    "chatgpt": "unknown",
    "cursor": "unknown",
    "opencode": "unknown"
  }
}
