{
  "schemaVersion": 1,
  "id": "presales-maintenance-quote",
  "name": "Devis de maintenance récurrente (TMA)",
  "publisher": "SkillzForest",
  "version": "0.1.0",
  "category": "development",
  "subcategory": "code",
  "description": "Produit le devis de TMA (maintenance récurrente) d'un projet.",
  "compatibility": {
    "claude-code": "native",
    "claude-ai": "native",
    "codex": "supported",
    "gemini": "supported",
    "mistral": "supported",
    "perplexity": "supported",
    "chatgpt": "unknown",
    "cursor": "unknown",
    "opencode": "unknown"
  }
}
